{
  "schemaVersion": 1,
  "attemptId": "attempt:aggregate-a-A-2",
  "unitId": "unit:aggregate-1",
  "subIntentId": "sub:a:A",
  "attemptNumber": 2,
  "role": "A",
  "executionId": "exec:aggregate-a-A-2",
  "sessionId": "ses-fixture-not-native",
  "modelRef": {
    "providerID": "fixture",
    "id": "fixture-model",
    "variant": "none"
  },
  "contextManifestFingerprint": "258b794c641e597f959115b96059a24f05df2530286c190dfff3e45d9fa5d259",
  "state": "RUNNING",
  "lease": {
    "owner": "controller-fixture",
    "token": 2,
    "expiresAtEvent": 4
  },
  "progress": "running",
  "errorClass": "none",
  "previousAttemptIds": [
    "attempt:aggregate-a-A-1"
  ]
}
